{
  "timestamp": "2026-06-22T11:06:52.503393Z",
  "status": "ok",
  "schema_version": "vehicle_runtime_package_v8_l1_candidate_v1",
  "model_state": {
    "driver_head_temp_c": 35.569571253334864,
    "passenger_head_temp_c": 35.49247722459791,
    "driver_feet_temp_c": 37.70178926441352,
    "passenger_feet_temp_c": 37.70178926441352,
    "second_row_driver_head_temp_c": 37.768717918414794,
    "second_row_passenger_head_temp_c": 37.69162388967784,
    "second_row_driver_feet_temp_c": 37.40357852882704,
    "second_row_passenger_feet_temp_c": 37.40357852882704,
    "front_cabin_temp_c": 38.2226640166998
  },
  "pmv": {
    "pmv_driver": 3.9323167999486364,
    "pmv_passenger": 4.094940604395783,
    "ppd_driver": 99.99892219113778,
    "ppd_passenger": 99.99980216621127,
    "pmv_second_row_driver": null,
    "pmv_second_row_passenger": null
  },
  "comfort_flags": {
    "driver_comfortable": true,
    "passenger_comfortable": false
  },
  "diagnostics": {
    "airflow_distribution_source": "unknown",
    "airflow_total_source": "unknown",
    "mode_key": "unknown",
    "face_fraction": null,
    "foot_fraction": null,
    "defrost_fraction": null,
    "lr_split_source": "unknown",
    "rh_source": "unknown",
    "forbidden_input_detected": false,
    "fallback_used": false,
    "missing_signal_list": [],
    "forbidden_keys_found": [],
    "adapter_warnings": [
      "RawAmbT missing (SIG): using amb_t_c for RawAmbT u-bus slot.",
      "Hct missing (AFE/SIG): heater-core outlet not supplied; FrntDefTmaEst uses EvaT/AmbT precision fallback.",
      "PosnFdh missing (AFE): defrost mix position not supplied; FrntDefTmaEst uses EvaT/AmbT precision fallback.",
      "TmaDef precision fallback: FrntDefTmaEst set to EvaT (PMV still runs; heating+defrost accuracy reduced).",
      "WinShdTEst estimated via first-order glass observer (windshield_glass_temp_c not supplied; init from state or AmbT).",
      "chtd_param_mode=safe_preview ignored because params_bundle_path is set."
    ],
    "driver_air_temp_source": "model_state",
    "passenger_air_temp_source": "model_state",
    "driver_air_temp_c": 35.569571253334864,
    "passenger_air_temp_c": 35.49247722459791,
    "driver_mrt_source": "model_state",
    "passenger_mrt_source": "model_state",
    "trace_status": "CHTD 28 states: 28 TRACE, 0 FAST_APPROX, 0 GAP",
    "error": null
  },
  "provenance": {
    "calibration_status": "spring_summer_v8_l1_candidate_not_vehicle_calibration",
    "airflow_mode": "v7_ac_mode_adjust_airflow_with_v8_l1_params",
    "chtd_param_mode": "safe_preview",
    "package_version": "vehicle_runtime_package_v8_l1_candidate_v1",
    "adapter_provenance": {
      "schema": "runtime_adapter_v1",
      "feature_flags": {
        "enable_ir_fusion": false,
        "enable_image_occupancy": true,
        "enable_runtime_conditioning": false,
        "enable_post_glass_defrost": false,
        "enable_geometry_merge": false,
        "enable_corrected_chtd": false,
        "enable_vehicle_adapted_params": true
      },
      "disabled_features": [
        "ir_fusion",
        "runtime_conditioning",
        "post_glass_defrost",
        "geometry_merge",
        "corrected_chtd"
      ],
      "active_features": [
        "image_occupancy",
        "vehicle_adapted_params"
      ],
      "chtd_mode": "AS_FOUND",
      "image_module": "present",
      "RawAmbT": {
        "status": "missing",
        "fallback": "amb_t_c"
      },
      "VehSpd": {
        "status": "sig",
        "value_kph": 60.0
      },
      "Solar": {
        "solar_fd_w_m2": 600.0,
        "solar_fp_w_m2": 400.0
      },
      "x_source": "ambient_uniform",
      "Hct": {
        "status": "precision_fallback",
        "fallback": "eva_t",
        "source": "AFE/SIG",
        "note": "Optional at runtime; improves TmaDef when supplied."
      },
      "PosnFdh": {
        "status": "precision_fallback",
        "fallback": "eva_t_only",
        "note": "Optional at runtime; improves TmaDef when supplied."
      },
      "TmaDef": {
        "source": "fallback_eva",
        "TmaDef_approx": true,
        "posn_fdh": null,
        "hct_c": null,
        "eva_t_c": 8.0,
        "approximate": true,
        "approx_reasons": [
          "hct_missing",
          "posn_fdh_missing"
        ],
        "fallback": "eva_t",
        "status": "precision_fallback"
      },
      "WinShdTEst": {
        "source": "estimate_windshield_glass_temp_step",
        "estimated": true,
        "glass_temp_init_c": 38.0,
        "delta_c": 0.0042,
        "heat_terms": {
          "q_defrost_w": -0.0,
          "q_cabin_w": 0.0,
          "q_external_w": 0.0,
          "q_solar_w": 210.0,
          "q_dashboard_w": 0.0,
          "q_net_w": 210.0
        },
        "dt_s": 1.0,
        "heat_capacity_j_k": 50000.0,
        "vehicle_speed_kph": 60.0,
        "defrost_flow_m3h": 0.0
      },
      "DefrostPostGlass": {
        "status": "disabled",
        "diagnostic_only": true,
        "note": "Set enable_post_glass_defrost=true to compute post-glass T."
      },
      "tma_fallback": {
        "default": "eva_t_or_amb_t",
        "eva_t_c": 8.0,
        "amb_t_c": 38.0,
        "explicit_count": 4
      },
      "flows_mapped": {
        "FrntFdvFlow": 45.0,
        "FrntFpvFlow": 45.0,
        "FrntFdfFlow": 0.0,
        "FrntFpfFlow": 0.0,
        "FrntFdDefFlow": 0.0,
        "FrntFpDefFlow": 0.0
      },
      "vent_flows": {
        "status": "explicit",
        "count": 6
      },
      "chtd_param_mode": "safe_preview",
      "safe_preview_active": true,
      "phase3_engineering_preview_active": false,
      "params_bundle": {
        "initial_params_source": "D:\\desk\\yzy\\vehicle_runtime_package_vnext\\config\\initial_calibration_params_v8_l1_candidate.json",
        "classification": "spring_summer_v8_l1_candidate_not_vehicle_calibration",
        "applied_afe_fields": [],
        "applied_chtd_fields": [
          "CHTD_Dt_P",
          "CHTD_QgainCo_P",
          "CHTD_QlossCo_P",
          "CHTD_CHTDSdlTi_P",
          "CHTD_AirCpAtb_P",
          "CHTD_HeadAirVAtb_P",
          "CHTD_FeetAirVAtb_P",
          "CHTD_HeadAreaAtb_P",
          "CHTD_FeetAreaAtb_P",
          "CHTD_HoodMassAtb_P",
          "CHTD_HoodCpAtb_P",
          "CHTD_HoodAreaAtb_P",
          "CHTD_CabinFrntMassAtb_P",
          "CHTD_CabinFrntCpAtb_P",
          "CHTD_CabinFrntAreaAtb_P",
          "CHTD_ConsoleMassAtb_P",
          "CHTD_ConsoleCpAtb_P",
          "CHTD_ConsoleAreaAtb_P",
          "CHTD_CabinFdMassAtb_P",
          "CHTD_CabinFdCpAtb_P",
          "CHTD_CabinFdAreaAtb_P",
          "CHTD_CabinFpMassAtb_P",
          "CHTD_CabinFpCpAtb_P",
          "CHTD_CabinFpAreaAtb_P",
          "CHTD_CabinSdMassAtb_P",
          "CHTD_CabinSdCpAtb_P",
          "CHTD_CabinSdAreaAtb_P",
          "CHTD_CabinSpMassAtb_P",
          "CHTD_CabinSpCpAtb_P",
          "CHTD_CabinSpAreaAtb_P",
          "CHTD_CabinTdMassAtb_P",
          "CHTD_CabinTdCpAtb_P",
          "CHTD_CabinTdAreaAtb_P",
          "CHTD_CabinTpMassAtb_P",
          "CHTD_CabinTpCpAtb_P",
          "CHTD_CabinTpAreaAtb_P",
          "CHTD_WinFdMassAtb_P",
          "CHTD_WinFdCpAtb_P",
          "CHTD_WinFdAreaAtb_P",
          "CHTD_WinFpMassAtb_P",
          "CHTD_WinFpCpAtb_P",
          "CHTD_WinFpAreaAtb_P",
          "CHTD_WinSdMassAtb_P",
          "CHTD_WinSdCpAtb_P",
          "CHTD_WinSdAreaAtb_P",
          "CHTD_WinSpMassAtb_P",
          "CHTD_WinSpCpAtb_P",
          "CHTD_WinSpAreaAtb_P",
          "CHTD_WinTdMassAtb_P",
          "CHTD_WinTdCpAtb_P",
          "CHTD_WinTdAreaAtb_P",
          "CHTD_WinTpMassAtb_P",
          "CHTD_WinTpCpAtb_P",
          "CHTD_WinTpAreaAtb_P",
          "CHTD_RoofMassAtb_P",
          "CHTD_RoofCpAtb_P",
          "CHTD_RoofAreaAtb_P",
          "CHTD_Dt_P",
          "CHTD_QgainCo_P",
          "CHTD_QlossCo_P",
          "CHTD_CHTDSdlTi_P",
          "CHTD_AirCpAtb_P",
          "CHTD_HeadAirVAtb_P",
          "CHTD_FeetAirVAtb_P",
          "CHTD_HoodMassAtb_P",
          "CHTD_CabinFrntMassAtb_P",
          "CHTD_ConsoleMassAtb_P",
          "HeadFdMassAtb",
          "HeadFpMassAtb",
          "HeadSdMassAtb",
          "HeadTdMassAtb",
          "HeadTpMassAtb",
          "FeetFdMassAtb",
          "FeetFpMassAtb",
          "FeetSdMassAtb",
          "FeetSpMassAtb",
          "FeetTdMassAtb",
          "FeetTpMassAtb",
          "CabinFdMassAtb",
          "CabinFpMassAtb",
          "CabinSdMassAtb",
          "CabinSpMassAtb",
          "CabinTdMassAtb",
          "CabinTpMassAtb",
          "WinFdMassAtb",
          "WinFpMassAtb",
          "WinSdMassAtb",
          "WinSpMassAtb",
          "WinTdMassAtb",
          "WinTpMassAtb",
          "RoofMassAtb",
          "HoodCpAtb",
          "CabinFrntCpAtb",
          "ConsoleCpAtb",
          "CabinFdCpAtb",
          "CabinFpCpAtb",
          "CabinSdCpAtb",
          "CabinSpCpAtb",
          "CabinTdCpAtb",
          "CabinTpCpAtb",
          "WinFdCpAtb",
          "WinFpCpAtb",
          "WinSdCpAtb",
          "WinSpCpAtb",
          "WinTdCpAtb",
          "WinTpCpAtb",
          "RoofCpAtb",
          "HoodAreaAtb",
          "CabinFrntAreaAtb",
          "ConsoleAreaAtb",
          "CabinFdAreaAtb",
          "CabinFpAreaAtb",
          "CabinSdAreaAtb",
          "CabinSpAreaAtb",
          "CabinTdAreaAtb",
          "CabinTpAreaAtb",
          "WinFdAreaAtb",
          "WinFpAreaAtb",
          "WinSdAreaAtb",
          "WinSpAreaAtb",
          "WinTdAreaAtb",
          "WinTpAreaAtb",
          "RoofAreaAtb",
          "HoodUAAtb",
          "CabinFrntUAAtb",
          "ConsoleUAAtb",